"name","itemId","price","currentPrice","brandName","sellerName","ratingScore","itemSold","location","image","itemUrl"
"9059 Pro Wired Gaming Headset – Stereo Bass RGB Gaming Headphone with Microphone | Comfortable PC & Mobile Gaming Headset for PUBG, Free Fire Pakistan",1954440011,3300,"Rs. 3,300","No Brand","NexaGears",0,0,"Punjab","https://static-01.daraz.pk/p/af992901432f006d4431998f2dd1478f.jpg","https://www.daraz.pk/products/9059-pubg-i1954440011.html"
"XTRIKE ME GH510 USB RGB Gaming Headset – 50mm Drivers, Stereo Sound, Noise-Cancelling Mic, RGB Lights for PC & Laptop",1952336383,2784,"Rs. 2,784","No Brand","Vital Plus",0,0,"Punjab","https://static-01.daraz.pk/p/37f4956155f3edb6ce1285e4e818bc96.png","https://www.daraz.pk/products/xtrike-me-gh510-usb-rgb-50-rgb-i1952336383.html"
"Best Polygold USB LED Gaming Headset with Microphone Computer Headset PG-6920 Polygold Pg Ultimate Gaming Wired Headphones with Mic - PC, Mobile, Laptop Compatible - Perfect for PUBG { head phones with wire for pc with mic }",609110647,2199,"Rs. 2,199","No Brand","Shining Star Mart",0,0,"Punjab","https://static-01.daraz.pk/p/9b8c5308e47018b1b1090858bdb65f84.png","https://www.daraz.pk/products/best-polygold-usb-led-gaming-headset-with-microphone-computer-headset-pg-6920-polygold-pg-ultimate-gaming-wired-headphones-with-mic-pc-mobile-laptop-compatible-perfect-for-pubg-head-phones-with-wire-for-pc-with-mic-i609110647.html"
"OKS® Wireless Mouse 2.4G Ergonomic and Slim Wireless mechanical Mouse Designed best Computer Gaming and offices for PC and Laptop - White & Black",945275172,1034.15,"Rs. 1,034","Oks Traders","Tech Treasures..",0,0,"Punjab","https://static-01.daraz.pk/p/ccb71fa7d1ef9dbdc141c8e05eb89f6d.png","https://www.daraz.pk/products/24g-i945275172.html"
"Xtrike ME GH-513W WH Tri-Mode (Bluetooth 6.0 + 2.4GHz Wireless + 3.5mm Wired) Gaming Headset | Stereo Sound with Dual EQ Modes | Detachable Omnidirectional Microphone.",1952241077,4999,"Rs. 4,999",".No Brand.","Al-Furqan Services",0,0,"Punjab","https://pk-live-21.slatic.net/kf/Sccc51a19f0c446cf83fefab208d80392Y.jpg","https://www.daraz.pk/products/xtrike-me-gh-513w-wh-60-24ghz-35mm-i1952241077.html"