"title","price","currency","originalPrice","isOnSale","rating","reviewCount","favorites","freeShipping","shopName","shopSales","yearsOnEtsy","starSeller","category","isAd","shopId","listingId","url","image/@context","image/@type","image/author","image/contentURL","image/description","image/thumbnail"
"Large Oushak Vintage Rug, Turkish, Hand-Made Wool, Bohemian Decor (6.8x10.3 ft)","524","USD","1310","true","4.9","738","35",,"VintageRugsHouse","6500","7","true","Home & Living < Floor & Rugs < Rugs",,,"4472293899","https://www.etsy.com/listing/4472293899/large-oushak-vintage-rug-turkish-hand","https://schema.org","ImageObject","VintageRugsHouse","https://i.etsystatic.com/19321899/r/il/e141c8/7857175797/il_fullxfull.7857175797_t1i4.jpg","May include: A rectangular, distressed-look rug with a central peach-colored field and a detailed border. The rug features a floral pattern with accents of blue and cream. The rug is displayed on a gray surface, with stacks of other rugs visible in the background.","https://i.etsystatic.com/19321899/r/il/e141c8/7857175797/il_340x270.7857175797_t1i4.jpg"
"Faded Blue Jute Rug: Moroccan Medallion Trellis Cottagecore Farmhouse Decor Area Rug - Handwoven & Vintage","109.95","USD","157.07","true","4.8","994","128",,"CarpetEmpire","5200","5","true","Home & Living < Floor & Rugs < Rugs",,,"4500802645","https://www.etsy.com/listing/4500802645/faded-blue-jute-rug-moroccan-medallion","https://schema.org","ImageObject","CarpetEmpire","https://i.etsystatic.com/27973061/r/il/740d8a/8040886365/il_fullxfull.8040886365_pat5.jpg","Vintage jute area rug with Moroccan quatrefoil pattern in faded denim blue, sage olive, tan beige, and soft peach. Handwoven cottagecore farmhouse flatweave.","https://i.etsystatic.com/27973061/c/3000/3000/0/0/il/740d8a/8040886365/il_340x270.8040886365_pat5.jpg"
"Vintage Refurbished Pre-Owned Mechanical Watch | Sky Blue Dial ST-96 Movement 17 Jewels Wrist watch.","40.42","USD","67.37","true","4.7","141","137",,"VintageWatchory","359",,"true","Jewelry < Watches < Wrist Watches < Men's Wrist Watches",,,"4497923143","https://www.etsy.com/listing/4497923143/vintage-refurbished-pre-owned-mechanical","https://schema.org","ImageObject","VintageWatchory","https://i.etsystatic.com/63005722/r/il/897292/7973702504/il_fullxfull.7973702504_54n8.jpg","May include: A vintage Oris wristwatch with a light blue face, gold hands and markers, and a black leather band. The watch face displays the text &quot;ORIS&quot;, &quot;17 JEWELS&quot;, and &quot;SHOCK PROOF&quot;. The watch has a stainless steel case.","https://i.etsystatic.com/63005722/r/il/897292/7973702504/il_340x270.7973702504_54n8.jpg"
"Vintage Seiko Tank Watch: Gold Plated Rectangular Case, Green Roman Numeral Dial","49.8","USD","83","true","4.6","48","2724",,"PROWATCHSTUDIO","2800","1","true","Jewelry < Watches < Wrist Watches < Men's Wrist Watches",,,"4352175271","https://www.etsy.com/listing/4352175271/vintage-seiko-tank-watch-gold-plated","https://schema.org","ImageObject","PROWATCHSTUDIO","https://i.etsystatic.com/60228150/r/il/306fd4/7109041162/il_fullxfull.7109041162_j99b.jpg","May include: A rectangular gold-toned wristwatch with a green face and Roman numeral hour markers. The watch features gold hands and a brown leather band. The watch face has a textured pattern and the brand name is visible.","https://i.etsystatic.com/60228150/r/il/306fd4/7109041162/il_340x270.7109041162_j99b.jpg"
"Romantic Cottagecore Floral Tote Bag, Handmade Patchwork Lace Shoulder Bag, Soft Vintage Aesthetic Everyday Bag, Dreamy Gift for Her","37.33","USD","106.67","true","4.2","6","402",,"AisleDesignStudios","108",,"true","Bags & Purses < Totes",,,"4515535925","https://www.etsy.com/listing/4515535925/romantic-cottagecore-floral-tote-bag","https://schema.org","ImageObject","AisleDesignStudios","https://i.etsystatic.com/64995455/r/il/236643/8139337037/il_fullxfull.8139337037_qgtk.jpg","May include: A hobo-style shoulder bag featuring a patchwork floral fabric body in shades of pink, green, and cream. The upper section is adorned with white lace, and the bag includes two brown leather straps attached with brass-toned metal rings.","https://i.etsystatic.com/64995455/r/il/236643/8139337037/il_340x270.8139337037_qgtk.jpg"
"USA Vintage Style 250th Anniversary Garden Flag, Faux Patchwork Vintage USA Flag for Independence Day, 4th of July Outdoor Decor, USA Flag","13.6","USD","33.99","true","4.6","30","388",,"snazzyjazzyshoppe","731",,"true","Home & Living < Outdoor & Gardening < Garden Decoration",,,"4514152607","https://www.etsy.com/listing/4514152607/usa-vintage-style-250th-anniversary","https://schema.org","ImageObject","snazzyjazzyshoppe","https://i.etsystatic.com/63125652/r/il/ea4b6c/8081608588/il_fullxfull.8081608588_qmoy.jpg","May include: A quilted garden flag featuring a dark blue canton with thirteen gold stars surrounding the text 250 YEARS. The flag has vertical red and cream stripes, with a bottom cream panel displaying the text AMERICA EST. 1776 and floral accents.","https://i.etsystatic.com/63125652/r/il/ea4b6c/8081608588/il_340x270.8081608588_qmoy.jpg"
"LED Table Number - Glowing Number - Illuminated  and engraved - Corporate | Gala | Restaurant | Venue -  QUANTITY Priced","12.95","USD",,"false","4.9","8","392",,"EventsTableDecor","2000","11","true","Home & Living < Home Decor < Wall Decor < Wall Hangings < Signs",,,"477924048","https://www.etsy.com/listing/477924048/led-table-number-glowing-number","https://schema.org","ImageObject","EventsTableDecor","https://i.etsystatic.com/9622330/r/il/caf134/6650412058/il_fullxfull.6650412058_cdwr.jpg","May include: A green acrylic table number with the number &quot;6&quot; in white. The table number is on a table with green and white floral arrangements and two clear glass cylinders with candles.","https://i.etsystatic.com/9622330/r/il/caf134/6650412058/il_340x270.6650412058_cdwr.jpg"
"Vintage Moissanite Engagement Ring Set Unique 14K Rose Gold Engagement Ring Women Eternity Moissanite Wedding Band Bridal Promise Ring Set","987","USD","1316","true","4.9","3438","635",,"FOneUS","11900","7","true","Jewelry < Rings < Wedding & Engagement < Engagement Rings",,,"1509385513","https://www.etsy.com/listing/1509385513/vintage-moissanite-engagement-ring-set","https://schema.org","ImageObject","FOneUS","https://i.etsystatic.com/18642848/r/il/c95545/5074648509/il_fullxfull.5074648509_qod5.jpg","May include: A rose gold engagement ring set with a large oval-shaped center stone surrounded by a halo of smaller stones. The ring is paired with a matching band featuring a row of smaller stones.","https://i.etsystatic.com/18642848/r/il/c95545/5074648509/il_340x270.5074648509_qod5.jpg"
"Marquise Cut Moissanite Engagement Ring, Vintage Style Antique Art Deco Style Engagement Ring, Unique Wedding Ring, Luxury Anniversary Ring","252.75","USD","495.58","true","4.7","795","10151",,"VintagediamondUS","3300","3","true","Jewelry < Rings < Wedding & Engagement < Engagement Rings",,,"1760842997","https://www.etsy.com/listing/1760842997/marquise-cut-moissanite-engagement-ring","https://schema.org","ImageObject","VintagediamondUS","https://i.etsystatic.com/36957399/r/il/6441c8/7541382398/il_fullxfull.7541382398_i7eq.jpg","Marquise Cut Moissanite Ring, Vintage Engagement Ring, Art Deco Style Ring, Unique Wedding Ring, Luxury Anniversary Ring, Moissanite Engagement Ring, Vintage Art Deco Ring, Antique Style Ring","https://i.etsystatic.com/36957399/c/1898/1898/692/614/il/6441c8/7541382398/il_340x270.7541382398_i7eq.jpg"
"Unique Moissanite Engagement Ring Set Natural Leaf Floral Ring Bridal Set Vintage Ring Moissanite Cluster Ring Set Anniversary Gifts for Her","726","USD","968","true","4.9","2059","75",,"ArcadiastudioUS","6400","5","true","Jewelry < Rings < Wedding & Engagement < Engagement Rings",,,"1651065975","https://www.etsy.com/listing/1651065975/unique-moissanite-engagement-ring-set","https://schema.org","ImageObject","ArcadiastudioUS","https://i.etsystatic.com/25082651/r/il/0a23c8/5693547279/il_fullxfull.5693547279_dal2.jpg","May include: A rose gold engagement ring set with an oval-shaped center stone and intricate floral details. The ring is set with smaller diamonds and has a delicate band.","https://i.etsystatic.com/25082651/c/1626/1292/180/354/il/0a23c8/5693547279/il_340x270.5693547279_dal2.jpg"
"Engagement Ring Emerald Cut Moissanite Ring Unique Hidden Halo Ring Yellow Gold Vintage Cluster Bridal Set Emerald Cut Wedding Ring Set","1049.5","USD","1234.71","true","4.9","1666","88",,"URTreasureBox","6000","6","true","Jewelry < Rings < Wedding & Engagement < Bridal Sets",,,"1679889052","https://www.etsy.com/listing/1679889052/engagement-ring-emerald-cut-moissanite","https://schema.org","ImageObject","URTreasureBox","https://i.etsystatic.com/22713616/r/il/322177/5930171983/il_fullxfull.5930171983_nql3.jpg","May include: A three-piece gold engagement ring set. The primary ring features a large, rectangular, clear gemstone. The set includes a diamond band and a curved band with marquise-cut stones. The rings are displayed on a dark green surface.","https://i.etsystatic.com/22713616/c/825/655/83/118/il/322177/5930171983/il_340x270.5930171983_nql3.jpg"
"Oval Moissanite Engagement Ring: Vintage Hidden Halo, Sterling Silver or Gold","254.66","USD","499.33","true","4.7","795","162",,"VintagediamondUS","3300","3","true","Jewelry < Rings < Wedding & Engagement < Engagement Rings",,,"1723462967","https://www.etsy.com/listing/1723462967/oval-moissanite-engagement-ring-vintage","https://schema.org","ImageObject","VintagediamondUS","https://i.etsystatic.com/36957399/r/il/d01829/6004699031/il_fullxfull.6004699031_2n58.jpg","May include: A gold engagement ring with a large, round, clear center stone surrounded by smaller stones. The ring has a delicate band with smaller stones set along the sides.","https://i.etsystatic.com/36957399/c/1592/1264/662/703/il/d01829/6004699031/il_340x270.6004699031_2n58.jpg"
"Vintage Ruby Red Glass Hen Dish, Farmhouse Decor, Multi-use Storage, Small & Large Sizes","36.4","USD","52","true","4.7","40","174",,"Jsjsjsjh","180",,"true","Home & Living < Kitchen & Dining < Kitchen Storage < Jars & Containers",,,"4492132849","https://www.etsy.com/listing/4492132849/vintage-ruby-red-glass-hen-dish","https://schema.org","ImageObject","Jsjsjsjh","https://i.etsystatic.com/65058275/r/il/2e3883/7935483226/il_fullxfull.7935483226_8rdy.jpg","May include: A ruby red glass hen-shaped covered dish. The hen has detailed feather and head features, with a textured surface. The dish sits in a matching base with a beaded rim. A decorative kitchenware item.","https://i.etsystatic.com/65058275/r/il/2e3883/7935483226/il_340x270.7935483226_8rdy.jpg"
"Set of 3 Vintage hardback Old Books Farmhouse decor customizable wedding decor Vintage Book Stacks Classic literature unique gift Authentic","24.97","USD",,"false","4.7","142","2929",,"CharmingTreasurFinds","10200","8","true","Books, Movies & Music < Books < Book Sets & Collections",,,"1170194176","https://www.etsy.com/listing/1170194176/set-of-3-vintage-hardback-old-books","https://schema.org","ImageObject","CharmingTreasurFinds","https://i.etsystatic.com/16895790/r/il/5cfe5f/7738693466/il_fullxfull.7738693466_hqoc.jpg",,"https://i.etsystatic.com/16895790/r/il/5cfe5f/7738693466/il_340x270.7738693466_hqoc.jpg"
"Solar Moon Star Sun Wind Chime Light, Vintage Hanging Lantern, Outdoor Garden Decor","25.03","USD","29.45","true","3.3","28","915",,"WillowYardGlow","240",,"true","Home & Living < Lighting < Light Fixtures < Garden & String Lights < Garden Lights",,,"4505069444","https://www.etsy.com/listing/4505069444/solar-moon-star-sun-wind-chime-light","https://schema.org","ImageObject","WillowYardGlow","https://i.etsystatic.com/65565951/r/il/500ed1/8019198132/il_fullxfull.8019198132_lfw2.jpg","May include: Solar-powered wind chimes with celestial designs, including moons, stars, and suns. The chimes hang from a wooden pergola, illuminating the night with warm and colorful LED lights. The outdoor decor adds a whimsical touch to a garden or patio.","https://i.etsystatic.com/65565951/r/il/500ed1/8019198132/il_340x270.8019198132_lfw2.jpg"
"Oval Moissanite engagement ring 14K gold engagement ring Vintage engagement ring hand engraving diamond ring Anniversary promise ring","1368.26","USD","2736.53","true","4.9","9394","20",,"BravermanOren","27100","11","true","Jewelry < Rings < Wedding & Engagement < Engagement Rings",,,"1407748235","https://www.etsy.com/listing/1407748235/oval-moissanite-engagement-ring-14k-gold","https://schema.org","ImageObject","BravermanOren","https://i.etsystatic.com/9792770/r/il/a01b15/4630294515/il_fullxfull.4630294515_5z33.jpg","May include: A gold engagement ring with an oval-shaped diamond set in a pave setting. The band is adorned with small diamonds.","https://i.etsystatic.com/9792770/c/1129/897/559/1226/il/a01b15/4630294515/il_340x270.4630294515_5z33.jpg"
"Large Framed Japanese Landscape Wall Art, Mount Fuji Canvas Print, Vintage Asian Nature Artwork, Zen Scenic Decor","142.49","USD","149.99","true","4.9","8440","79",,"DustinWay","40500","4","true","Art & Collectibles < Prints < Digital Prints",,,"4478433825","https://www.etsy.com/listing/4478433825/large-framed-japanese-landscape-wall-art","https://schema.org","ImageObject","DustinWay","https://i.etsystatic.com/34335965/r/il/3c9e8a/7847844694/il_fullxfull.7847844694_d87m.jpg","May include: A framed landscape painting depicting a serene mountain scene with a lake and trees. The artwork features a light brown wooden frame and is displayed above a green velvet sofa. The color palette includes shades of green, blue, and brown.","https://i.etsystatic.com/34335965/r/il/3c9e8a/7847844694/il_340x270.7847844694_d87m.jpg"
"Vintage 3 Piece Men&#39;s Linen Suit, Retro Gentleman Wedding Outfit By Maricsuits","242.96","USD","485.92","true","4.1","9","73",,"Maricsuits","48",,"true","Clothing",,,"4480532839","https://www.etsy.com/listing/4480532839/vintage-3-piece-mens-linen-suit-retro","https://schema.org","ImageObject","Maricsuits","https://i.etsystatic.com/61545238/r/il/f5ac95/7909528185/il_fullxfull.7909528185_m7z4.jpg","May include: A three-piece dark charcoal suit with a straw hat. The suit includes a jacket, vest, and trousers. The model is wearing a white dress shirt and a patterned tie. The brand name &quot;MARICSUITS&quot; is at the top of the image.","https://i.etsystatic.com/61545238/r/il/f5ac95/7909528185/il_340x270.7909528185_m7z4.jpg"
"Vintage Peek-a-boo Watch Collection","200.19","USD",,"false","4.9","370","28",,"RelicWatchesShop","1600","5","true","Jewelry < Watches < Wrist Watches < Women's Wrist Watches",,,"4523589846","https://www.etsy.com/listing/4523589846/vintage-peek-a-boo-watch-collection","https://schema.org","ImageObject","RelicWatchesShop","https://i.etsystatic.com/48171055/r/il/e6631a/8148404522/il_fullxfull.8148404522_9lye.jpg",,"https://i.etsystatic.com/48171055/r/il/e6631a/8148404522/il_340x270.8148404522_9lye.jpg"
"Vintage PU Leather Crossbody Bag, Retro Multi-Layer Shoulder Purse, Brown Red Messenger Handbag","24.99","USD","49.99","true","5","1","17",,"BoutiqueBySJS","10",,"true","Bags & Purses < Handbags < Shoulder Bags",,,"4515893247","https://www.etsy.com/listing/4515893247/vintage-pu-leather-crossbody-bag-retro","https://schema.org","ImageObject","BoutiqueBySJS","https://i.etsystatic.com/65242886/r/il/dd8e12/8094105636/il_fullxfull.8094105636_77h2.jpg","May include: A brown leather crossbody bag with a textured finish, featuring multiple zippered compartments, silver-tone hardware, three decorative metal rings on the front pocket, and a braided strap detail on the lower right side.","https://i.etsystatic.com/65242886/r/il/dd8e12/8094105636/il_340x270.8094105636_77h2.jpg"
"Vintage Style Muse Engagement Ring, 2.51 TCW Cushion Rensu Colorless Moissanite Ring, Side Round Colorless Moissanite, Proposal Wedding Ring","356.25","USD","475","true","4.9","6197","1059",,"diamondrensu","17300","8","true","Jewelry < Rings < Wedding & Engagement < Engagement Rings",,,"1421255888","https://www.etsy.com/listing/1421255888/vintage-style-muse-engagement-ring-251","https://schema.org","ImageObject","diamondrensu","https://i.etsystatic.com/14466790/r/il/7fcb81/6682690422/il_fullxfull.6682690422_2xok.jpg","vintage moissanite rings","https://i.etsystatic.com/14466790/c/1563/1563/230/286/il/7fcb81/6682690422/il_340x270.6682690422_2xok.jpg"
"Vintage Metal Sign Home Room Wall Bathroom Garden Decoration 16 x 4 Inches","8.09","USD","8.99","true","4.6","24","98",,"TTGgood","159",,"true","Home & Living < Home Decor < Wall Decor < Wall Hangings < Signs",,,"4493228185","https://www.etsy.com/listing/4493228185/vintage-metal-sign-home-room-wall","https://schema.org","ImageObject","TTGgood","https://i.etsystatic.com/50375022/r/il/512ae0/7942282786/il_fullxfull.7942282786_jwiy.jpg","May include: Rectangular metal sign with the words &quot;LOVE YOU, BYE&quot; in black block letters. The sign has a distressed, rusty appearance with a white background, giving it a vintage aesthetic.","https://i.etsystatic.com/50375022/r/il/512ae0/7942282786/il_340x270.7942282786_jwiy.jpg"
"Comfort Colors Vintage Insect Music Graphic Tee Musical Bugs Illustration Tee","25.43","USD","47.98","true","5","5","203",,"TheSentimentalThread","64",,"true","Clothing",,,"4503604555","https://www.etsy.com/listing/4503604555/comfort-colors-vintage-insect-music","https://schema.org","ImageObject","TheSentimentalThread","https://i.etsystatic.com/64641454/r/il/247290/8010524284/il_fullxfull.8010524284_3f5f.jpg","May include: Moss green t-shirt featuring a whimsical illustration of six anthropomorphic insects playing musical instruments. The insects include a beetle, grasshopper, ladybug, bee, and two others. A gold necklace rests on the shirt.","https://i.etsystatic.com/64641454/r/il/247290/8010524284/il_340x270.8010524284_3f5f.jpg"
"Hexagon cut Moissanite Solitaire Vintage Inspired Engagement Ring | 14K Rose Gold Filigree Engraving Wedding Band | Unique Gift for Her","1039.99","USD","2079.97","true","4.9","9394","312",,"BravermanOren","27100","11","true","Jewelry < Rings < Wedding & Engagement < Engagement Rings",,,"1648927550","https://www.etsy.com/listing/1648927550/hexagon-cut-moissanite-solitaire-vintage","https://schema.org","ImageObject","BravermanOren","https://i.etsystatic.com/9792770/r/il/82bb97/5743527263/il_fullxfull.5743527263_8gwj.jpg","Hexagon cut Moissanite Solitaire Proposal Ring 14K 18K Rose Gold Filigree Scrollwork Engraving 1920s Inspired","https://i.etsystatic.com/9792770/c/912/724/95/316/il/82bb97/5743527263/il_340x270.5743527263_8gwj.jpg"
"3 CT Marquise Lab Grown Diamond Engagement Ring, Vintage Inspired Art Deco 14K Gold Engraved Wedding Ring, IGI Certified Ring, Promise Ring","1141.46","USD","1630.66","true","5","10","103",,"ElaraDiamonds","40",,"true","Jewelry < Rings < Wedding & Engagement < Engagement Rings",,,"4490100095","https://www.etsy.com/listing/4490100095/3-ct-marquise-lab-grown-diamond","https://schema.org","ImageObject","ElaraDiamonds","https://i.etsystatic.com/64118863/r/il/64bc97/7922226504/il_fullxfull.7922226504_cxrk.jpg","May include: A gold engagement ring with a large, pear-shaped diamond as the centerpiece. The band features intricate filigree and small accent diamonds. The ring&#039;s setting is a warm gold color, and the overall design is elegant and vintage-inspired.","https://i.etsystatic.com/64118863/c/922/922/97/83/il/64bc97/7922226504/il_340x270.7922226504_cxrk.jpg"
"Marquise Moissanite 2.5ct Engagement Ring, Vintage Petal Tulip Prong Setting with Round Diamonds Ob  Bridge Setting, Lotus Prong Ring Gift","133.31","USD","177.75","true","4.9","743","720",,"GemOfJewel","2800","5","true","Jewelry < Rings < Wedding & Engagement < Engagement Rings",,,"4307476770","https://www.etsy.com/listing/4307476770/marquise-moissanite-25ct-engagement-ring","https://schema.org","ImageObject","GemOfJewel","https://i.etsystatic.com/24898998/r/il/00824a/7004345229/il_fullxfull.7004345229_c9cw.jpg","","https://i.etsystatic.com/24898998/c/1290/1290/0/475/il/00824a/7004345229/il_340x270.7004345229_c9cw.jpg"
"Vintage Refurbished Seiko 5 Automatic Day/Date Japan Made Men&#39;s Wrist Watch","73.72","USD","98.29","true","3.8","17","136",,"AbroadWatches","115",,"true","Jewelry < Watches < Wrist Watches < Men's Wrist Watches",,,"4466233848","https://www.etsy.com/listing/4466233848/vintage-refurbished-seiko-5-automatic","https://schema.org","ImageObject","AbroadWatches","https://i.etsystatic.com/63258651/r/il/755075/7815666969/il_fullxfull.7815666969_ekxg.jpg","May include: Gold-toned Seiko 5 automatic wristwatch with a burgundy dial. The watch features gold hands and markers, a day-date display, and a gold link bracelet. The dial reads &quot;SEIKO 5 AUTOMATIC JAPAN MADE&quot;.","https://i.etsystatic.com/63258651/r/il/755075/7815666969/il_340x270.7815666969_ekxg.jpg"
"Vintage Engagement Ring, 3.0 TCW Oval Cut Green Moissanite Engagement Ring, Moissanite Wedding Ring, Anniversary Gifts for Her, Muse Setting","344.25","USD","459","true","4.9","3128","475",,"Caratdiamond","10000","6","true","Jewelry < Rings < Wedding & Engagement < Engagement Rings",,,"1104115349","https://www.etsy.com/listing/1104115349/vintage-engagement-ring-30-tcw-oval-cut","https://schema.org","ImageObject","Caratdiamond","https://i.etsystatic.com/20952682/r/il/82dcc9/3404285450/il_fullxfull.3404285450_inb7.jpg","vintage engagement ring","https://i.etsystatic.com/20952682/c/2040/1622/418/671/il/82dcc9/3404285450/il_340x270.3404285450_inb7.jpg"
"America Applique Patchwork Embroidered Sweatshirt, Patriotic USA Crewneck, Vintage Patchwork 4th of July Shirt, Americana Gift","29","USD","50","true","4.5","444","779",,"Ubestgift1","3700","1","true","Clothing",,,"4512004606","https://www.etsy.com/listing/4512004606/america-applique-patchwork-embroidered","https://schema.org","ImageObject","Ubestgift1","https://i.etsystatic.com/58533509/r/il/868671/8114405837/il_fullxfull.8114405837_8ts4.jpg","May include: A light blue sweatshirt with a patchwork American flag design. The flag features white stars on a blue field and red and white striped sections. The sweatshirt has a crew neck and ribbed cuffs.","https://i.etsystatic.com/58533509/r/il/868671/8114405837/il_340x270.8114405837_8ts4.jpg"
"1986 Retro Birthday Sweatshirt – Vintage 40th Birthday Gift – Unisex T-Shirt for Men & Women – Classic 90s Style Party Anniversary Outfit","12.71","USD","16.95","true","4.8","10462","3699",,"freedomlook","81400","8","true","Clothing",,,"1497161058","https://www.etsy.com/listing/1497161058/1986-retro-birthday-sweatshirt-vintage","https://schema.org","ImageObject","freedomlook","https://i.etsystatic.com/16591606/r/il/b2ea02/8110982087/il_fullxfull.8110982087_mrcb.jpg","May include: Cream-colored sweatshirt with a retro design featuring the text &quot;JUNE 1986&quot; in a vintage font. The design includes a rainbow, mountains, and the words &quot;LIMITED EDITION&quot;. The sweatshirt also has the text &quot;CUSTOM BIRTH MONTH/YEAR MULTIPLE COLORS&quot;.","https://i.etsystatic.com/16591606/r/il/b2ea02/8110982087/il_340x270.8110982087_mrcb.jpg"
"Floral Coir Doormat, Vintage Wildflower Rug, Housewarming Gift","19.5","USD","35.45","true","4.9","15153","2522",,"WowMats","65100","6","true","Home & Living < Floor & Rugs < Door Mats",,,"1426734786","https://www.etsy.com/listing/1426734786/floral-doormat-colorful-welcome-mat","https://schema.org","ImageObject","WowMats","https://i.etsystatic.com/20748602/r/il/d7397b/8122840672/il_fullxfull.8122840672_b6zu.jpg","A person&#39;s feet standing on a decorative, floral-patterned rug with a dark green and brown color scheme.","https://i.etsystatic.com/20748602/r/il/d7397b/8122840672/il_340x270.8122840672_b6zu.jpg"
"Rustic Metal Mushroom Garden Stakes, Vintage Farmhouse Yard Art","34.64","USD","54.99","true","5","3","140",,"HomeLuma","48",,"true","Home & Living < Outdoor & Gardening < Garden Decoration < Yard Art",,,"4517811420","https://www.etsy.com/listing/4517811420/rustic-metal-mushroom-garden-stakes","https://schema.org","ImageObject","HomeLuma","https://i.etsystatic.com/63528315/r/il/87cc39/8155296227/il_fullxfull.8155296227_9l0y.jpg","May include: A set of three copper-colored metal mushroom sculptures with textured, wide caps and slender stems. The sculptures are arranged in a cluster, featuring a tall central mushroom flanked by two shorter ones, all with a metallic finish.","https://i.etsystatic.com/63528315/r/il/87cc39/8155296227/il_340x270.8155296227_9l0y.jpg"
"Vintage Funny Cat Shirt, Punk Kitten, Oversize, Womens, Mens, Comfort Colors T-shirt","20.24","USD","26.99","true","4.9","3084","1329",,"KickAshCo","19300","16","true","Clothing",,,"4466232917","https://www.etsy.com/listing/4466232917/vintage-funny-cat-shirt-punk-kitten","https://schema.org","ImageObject","KickAshCo","https://i.etsystatic.com/5768653/r/il/fb4526/7767737576/il_fullxfull.7767737576_bisj.jpg","May include: Black t-shirt featuring a distressed graphic of a cat with a mohawk and spiked collar. The cat is depicted in shades of gray and white, with a punk rock aesthetic. The shirt has rolled-up sleeves and a classic crew neck.","https://i.etsystatic.com/5768653/r/il/fb4526/7767737576/il_340x270.7767737576_bisj.jpg"
